Title,Company,City,Country,Type,Summary,Email,Website,Source,PostedDate
Social Media Marketing Praktikant / Werkstudent (m/w/x),GOCOMO GmbH,Berlin,Germany,['Part-time'],"#PRODUKT  Wir decken alle Aspekte des Influencer Marketings ab. Marken sagen uns nach wem sie suchen und wir setzen unsere Technologien und Expertise ein, um die perfekten Influencer zu identifizieren und mit den Marken zu verbinden. Konzeption, Scouting, Umsetzung, Auswertung – wir erschaffen bedeutungsvolle Beziehungen zwischen unseren Partnern und ihren Influencer-Fans, durch deren Hilfe eine langfristige und authentische Ansprache der Endkunden möglich wird.   #TEAM  Im April 2018 saßen die Gründer Marin und Sascha noch zu zweit im Büro, mittlerweile sind wir ein unfassbar tolles 14-köpfiges Team und arbeiten mit großartigen Partnern wie dm, Rocka Nutrition und der Adidas Group zusammen.  Wir bauen gerade das beste Team in Berlin auf und wollen, dass du ein Teil davon wirst! Wir suchen Anpacker, Querdenker, Visionäre, Witzbolde und Optimisten. Oder anders ausgedrückt: Menschen mit Charakter. Check out how we roll!  Klingt spannend? Super! Dann schau dir doch gerne hier eine detaillierte Beschreibung der Position an.  Deine Aufgaben  Umsetzung von Influencer Kampagnen  Ideenfindung, Ausführung und analytische Auswertung von Kampagnen Identifikation von und Kommunikation mit Influencern Erstellung von Projekdokumenten (Angebote, Analysen, Reportings...)  Business Development  Ausarbeitung und Umsetzung von Strategieprojekten (Themenbereiche: Sales, Finance, Recruiting, Organisation) Aktive Mitgestaltung unserer Feedbackkultur, welche auf dem Prinzip Radical Candor basiert   Dein Profil  Du befindest dich im fortgeschrittenen Stadium oder bist Absolvent eines themenrelevanten Studiums, zum Beispiel BWL, Wirtschaftspsychologie oder Marketing Du hast idealerweise erste Praxiserfahrung gesammelt Du hast ein starkes Interesse für Social Media gepaart mit einer ausgeprägten Kreativität Du übernimmst gerne Verantwortung für dich, dein Team, unsere Kunden und auch die kleinen Dinge - denn am Ende zählt jedes Detail Du hast exzellente analytische Fähigkeiten und eine schnelle Auffassungsgabe Du verfügst über eine hohe Leistungsmotivation, die sich in einer hohen Ergebnisqualität widerspiegelt Du hast ein authentisches Auftreten gepaart mit einer positiv-neugierigen Grundeinstellung Du liebst neue Herausforderungen und Szenarien Dein Deutsch und Englisch ist fließend in Wort und Schrift und dir bereitet die Ausarbeitung von Texten sehr viel Spaß   Was wir dir bieten  Ein familiäres, freundliches und engagiertes Team in einem zukunftsorientierten Tech-Startup Innovative Influencer-Marketing Projekte in Zusammenarbeit mit national und international bekannten Marken. Bei uns gestaltest du das Marketing von morgen Offene Feedbackkultur, basierend auf dem Konzept “Radical Candor”, mit reichlich Möglichkeiten sich professionell und persönlich weiterzuentwickeln Exzellenten Aufstiegschancen - Wenn alles passt, behalten wir dich sehr gerne langfristig bei uns, zum Beispiel als Junior Project Manager Ein ansprechendes Gehalt Regelmäßige Teamevents (Paintball, Stand-up Paddling, Yoga etc.) Du bist Teil des coolsten Teams in Berlin – goCOMO or go home – bisher wollte keiner mehr gehen   Wenn du jemanden kennst, dessen Traumberuf dies sein könnte, sende gerne deine Empfehlung an david@gocomo.io - du erhältst einen 300€ Referral-Bonus, wenn diese Person eingestellt wird!",['david@gocomo.io'],https://www.indeed.com/rc/clk?jk=fd1a5eea01c29e8c&from=vj&pos=top,indeed,vor 4 Monaten
Werkstudent/in Social Media Monitoring (m/f/d),StoryMachine GmbH,Berlin-Kreuzberg,Germany,"['Part-time', 'Contract']","Wir suchen zum nächstmöglichen Zeitpunkt eine/n Werkstudenten/in (m/f/d) zur Verstärkung unseres Teams: StoryMachine ist eine 2017 gegründete Social-Media-Agentur mit dem Schwerpunkt auf strategischem Storytelling für Brands, Persönlichkeiten und politische Institutionen. Die Basis unseres integrativen Storytellings ist journalistisch und komplett datengetrieben. Wir betrachten Social Channels nicht isoliert, sondern heben ihre Stärken und Besonderheiten hervor und bringen sie zum Vorteil unserer Kunden ein.Als Werkstudent/in übernimmst du ab dem ersten Tag Verantwortung und bist ein fester Bestandteil unseres Newsrooms. Dabei bist du Ideengeber und arbeitest an spannenden Projekten.Deine Aufgaben: Ein Fokus deiner Arbeit wird auf der Auswertung von Kampagnen auf allen relevanten Social Media-Kanälen liegenUnterstützung im operativen Tagesgeschäft bei der Betreuung unserer KundenMitwirkung bei der Entwicklung eines Dashboards und anderer operativer Reports für den Bereich Public Affairs / Personal Branding (Wirtschaft)Erarbeitung und Umsetzung von Ideen zur Effizienzsteigerung im Rahmen des Monitoring in weiterführenden ReportingsVor- und Nachbereitung, sowie Präsentation von internen MeetingsIn Absprache mit unseren Performance Marketing-Experten kreierst Du Handlungsempfehlungen zur Optimierung der Kampagne, um bestmöglichen Erfolg zu garantierenDu bringst mit: Mindestens 2. Fachsemester im Bereich BWL, Kommunikationswissenschaften, Medienwirtschaft, Marketing, Politikwissenschaft oder WirtschaftDu bringst Begeisterung und Erfahrung im Umgang mit Social Media-Plattformen mitBereitschaft am Wochenende zu arbeitenStrukturierte, selbstständige Arbeitsweise, sowie ein hoher QualitätsanspruchDigital-Expertise und Gespür für digitale TrendsGute praktische Erfahrungen mit Excel (z.B. Pivot, Grafiken)Teamfähigkeit, Kommunikationsstärke sowie DurchsetzungsvermögenZahlenaffinität und starke analytische FähigkeitenGute Kenntnisse in Deutsch und EnglischUnser Versprechen: Wir bieten Dir Freiräume, um deine persönliche Erfolgsgeschichte zu schreiben. Du trägst Verantwortung und bist in den Top-Management Entscheidungen von großer Tragweite involviert. Zudem kannst du dich auf regelmäßige Networking Events mit ranghohen Politikern und Medienvertretern, vielfältige Coachingangebote, Team Lunches, Fun- Mondays und den StoryMachine E-Roller freuen.Art der Stelle: Teilzeit, WerkvertragSprache:Englisch (Bevorzugt)Deutsch (Erforderlich)",,,indeed,
Werkstudent Finance & Controlling (m/w/d) in Berlin,MEDWING GmbH,Berlin,Germany,"['Part-time', 'Contract']","Bist Du auf der Suche nach einem tollen Studierendenjob mit viel Eigenverantwortung in einem erfolgreichen Start-Up mitten im Herzen von Berlin? Dann bist Du bei uns genau richtig!MEDWING ist ein innovatives Start-up, das den Stellenmarkt im Gesundheitswesen revolutionieren wird. Wir vereinfachen das Recruiting von temporärem und festem Personal bis hin zu Praktika. Somit sollen sich Fachleute des Gesundheitswesens auf das konzentrieren können, was sie am besten können: Pflegen. Werde auch Du Teil des jungen und dynamischen Teams und hilf uns dabei, das Gesundheitssystem langfristig und nachhaltig zu verändern!DEINE AUFGABEN – SPANNEND UND HERAUSFORDERND!Du unterstützt unser Team bei der Rechnungsprüfung und der BelegerfassungDu erstellst Analysen und Reportings für das ManagementDu hilfst uns, unsere Prozesse im Bereich Finance kontinuierlich zu verbessernDu unterstützt bei den monatlichen und jährlichen Abschlüssen und den InvestorenreportsDEIN PROFIL – KOMMUNIKATIV, PRAGMATISCH UND MIT START-UP DRIVE!Bestenfalls studierst Du BWL bzw. eine Studienrichtung mit dem Schwerpunkt Finanz- oder Rechnungswesen.Idealerweise konntest Du bereits praktische Erfahrungen im Bereich Finanz- und Rechnungswesen sammeln.Du besitzt fundierte Kenntnisse in den gängigen MS-Office Anwendungen (insbesondere Excel).Du bist kommunikativ, engagiert. Eigeninitiative verbunden mit Teamgeist und Flexibilität zeichnen dich aus.DEINE BENEFITS – UNSCHLAGBAR UND VIELSEITIG!Modernes Office mit großer Dachterrasse in Berlin-Mitte mit sehr guter Anbindung per Bus und BahnSehr erfahrenes Gründerteam (HeavenHR, Home24, Bain)Tech-Driven Start-Up mit international renommierten InvestorenRabatte bei externen Partnern, tolle Company- und Teamevents, kostenlose Getränke und Bio-ObstEigenverantwortung & eine steile LernkurveEinzigartige Unternehmenskultur und eine Menge Spaß!Du hast Fragen zu Stellenprofil und Bewerbung? Dann wende dich direkt an Laura Nitzsche (Recruiting Managerin) unter 030-549082979.Nutze die Chance und werde Teil unseres großartigen Teams. Sende uns Deine aussagekräftige Bewerbung inklusive Startdatum über das Bewerbungsformular.Mehr Informationen und Eindrücke findest du hier: www.kununu.com/medwing.Art der Stelle: Teilzeit, WerkvertragSprache:Deutsch (Erforderlich)",,,indeed,vor 2 Tagen
Werkstudent/in Logistik & Operations,Liefery,Berlin,Germany,['Part-time'],"Dein AufgabenbereichWir verstehen uns selbst als die Zukunft der letzten Meile im E-Commerce und revolutionieren als Same Day Delivery Plattform den Online Handel. Wie? Mit innovativen Servicekonzepten, modernster IT und logistischem Know How. Als Werkstudent/in unterstützt Du das Stationspersonal bei der Abwicklung der Touren.Du unterstützt das Stationspersonal bei allen operativen Abläufen von der Warenannahme und -kontrolle über Tourenoptimierung bis hin zur Überwachung der WarenausgabeDabei stehst Du im engen Austausch mit unseren Kurierfahrer/innenDu bist der/die Ansprechpartner/in, sobald es um die Betreuung und Beratung von unseren Kurierfahrer|innen bezüglich des gesamten Logistikprozesses gehtMit deiner Hands-On-Mentalität greifst du in schwierigen Situationen ein und kümmerst dich um einen reibungslosen operativen TagesablaufDein ProfilDu bist eingeschriebene/r Student/in im Bereich der Wirtschaftswissenschaften / BWL / Logistik oder einer anderen spannenden FachrichtungBelastbarkeit, Zuverlässigkeit und Durchsetzungsvermögen gehören zu deinen StärkenDu verfügst über ausgeprägt analytische und konzeptionelle Fähigkeiten und kannst sowohl gut allein, als auch als Teil eines hochmotivierten Teams arbeitenHohe Einsatzbereitschaft und Flexibilität zeichnen dich ausDu hast Kenntnisse mit MS Office Anwendungen (Word, Excel, Outlook)Du kannst unser Stationspersonal entweder in den Morgenstunden von5:00 - 13:30 Uhr, abends von16:30 - 00:30 Uhr oder von12:00 - 20:00 Uhrunterstützen; idealerweise bist Du auch samstags einsatzbereitDas bekommst Du nur bei Liefery: Grundregel: Wer gute Ideen hat und sich engagiert, der kann bei uns alles machen und alles werdenKeine Langeweile! Liefery ist ein Arbeitsumfeld, das jeden Tag in Bewegung istEine spannende und anspruchsvolle Position mit viel GestaltungsspielraumGemeinschaft ist bei uns alles. Liefery ist eine Familie, die nicht nur im Job zusammenhältArbeitszeiten sind flexibel, denn wir richten uns nach deinem StudienplanWenn Du auf der Suche nach einer spannenden Herausforderung und einer offenen und teamorientierten Unternehmenskultur bist, dann freuen wir uns über Deine aussagekräftigen Bewerbungsunterlagen mit der Nennung des frühestmöglichen Eintrittstermins.LieferFactory GmbHMontanstraße 18b13407 BerlinArt der Stelle: TeilzeitStandort:Berlin (Bevorzugt)",,,indeed,
Werkstudent (m/w/d) - Event Management,Zalando SE,Berlin,Germany,['Part-time'],"ÜBER DAS TEAM In unserem Event Management Team erwarten dich spannende Events mit den unterschiedlichsten Zielgruppen und Themen. Unterstütze aktiv und effizient den reibungslosen Ablauf aller internen und externen Events bei Zalando und werde Teil unseres Teams im Bereich der Zalando Real Estate Services. DEINE HERAUSFORDERUNG BEI UNS Stelle als zuverlässiger Ansprechpartner eine reibungslose und langfristige Zusammenarbeit mit verschiedenen Dienstleistern, Agenturen und internen Stakeholder sicher Organisiere mit deinem Team kleinere Veranstaltungen Helfe bei der Vorbereitung von Review Meetings Recherchiere im Internet nach neuen Locations oder prüfe Rechnungen und bereite Belege für die Weiterverarbeitung in der Buchhaltung vor WAS DU MITBRINGST Aktuell studierst du Eventmanagement, BWL oder einen ähnlichen Studiengang Praktische Erfahrungen in administrativen Tätigkeiten konntest du in Form von Praktika oder Werkstudententätigkeiten sammeln Organisieren ist eine deiner großen Stärken, du handelst proaktiv und überzeugst stets mit klarer Kommunikation auf Englisch und Deutsch MS Office Kenntnisse, insbesondere in Excel und PowerPoint BENEFITS Eine auf Vertrauen, Förderung und Feedback basierende Arbeitsumgebung; positive, inspirierende Arbeitsatmosphäre. Rabatte bei externen Partnern, Büros an zentralen Standorten, großartige IT-Ausstattung, flexible Arbeitszeiten, zusätzliche Urlaubstage und Freistellungsmöglichkeit für ehrenamtliche Tätigkeiten, kostenlose Getränke und Früchte, diverse Sport- und Gesundheitsangebote Mentoring und persönliche Entwicklungsmöglichkeiten durch ein internationales Team von Experten Wir leben Vielfalt. In unseren Teams bringen wir Menschen mit unterschiedlichen Hintergründen, Perspektiven und Fähigkeiten zusammen. Jede Personalentscheidung wird auf der Grundlage von Qualifikationen, Leistung und den Anforderungen des Unternehmens getroffen. WER WIR SIND Zalando ist Europas führende Online-Plattform für Mode und verbindet Kunden, Marken und Partner in 17 Ländern. Wir fördern die Entwicklung digitaler Lösungen für Mode, Logistik, Werbung und Forschung und versorgen mehr als 23 Millionen aktive Kunden von Kopf bis Fuß mit der neuesten Mode, mit Hilfe eines Teams, das durch unterschiedlichste Talente, Interessen und Sprachen geprägt ist. Bitte beachte, dass alle Bewerbungen mit dem Online-Formular ausgefüllt werden müssen - wir akzeptieren keine Bewerbungen per E-Mail.",,https://www.indeed.com/rc/clk?jk=77fab6d1c9c465da&from=vj&pos=top&spon=1&adid=295964259&sjdu=IGHj9lL0ttzptxlOqCkr7BP1THalfmntIuCKiUAXhuh9A3yiWhjjgeTDuOikla6Z,indeed,
Werkstudent für Online Marketing [m/w/d],ALLVR GmbH,Berlin,Germany,"['Full-time', 'Part-time', 'Internship', 'Permanent']","Deine Skills: Du studierst BWL oder ein vergleichbares Studiumfach mit Schwerpunkt Marketing & Kommunikation?Du besitzt eventuell schon erste praktische Erfahrungen im Online- und im Social-Media Marketing?Begriffe wie Performance Marketing und SEO interessieren dich?Du bist gut in Verfassen von Texten, Blogeinträgen und Produktbeschreibungen?Du verstehst es Produkte effektiv zu vermarktenDu zeichnest dich durch deine Kommunikationsstärke aus, bist aufgeschlossen und arbeitest strukturiertDu bist kreativ und verstehst es sowohl konzeptionell, als auch praktisch zu arbeitenWas dich bei uns erwartet: Arbeit in einem jungen Startup, in einem kleinen engagierten und interdisziplinären Team im Herzen BerlinsSelbständiges Durchführen Facebook & Google Ad-KampagnenGestaltung eigener Inhalte für die Online-KampagnenVerwalten und Befüllen der Social-Media-KanäleVerfassen von Blog-Einträgen und Aufsetzen des monatlichen NewslettersWeiterentwicklung des Webauftrittes und der Webpräsenz des UnternehmensEnge Zusammenarbeit mit dem Sales & dem Design-TeamDie Möglichkeit den Geschäft- und Markterfolg der Firma aktiv voran zu treiben und mitzugestaltenHohe Verantwortung für Kampagenen und ProduktvermarktungEigenverantwortliches Arbeiten mit flachen Hierarchien und vereinbarten ZielenAttraktive WeiterentwicklungsmöglichkeitenFlexible ArbeitszeitenArt der Stelle: Vollzeit, Teilzeit, Praktikum, FestanstellungGehalt: 10,00 € bis 13,00 € /StundeBerufserfahrung:Performance Marketing: 1 Jahr (Bevorzugt)Content Marketing: 1 Jahr (Bevorzugt)Sprache:Deutsch (Erforderlich)",,,indeed,
Werkstudent Finance & Controlling (m/w/d) in Berlin,MEDWING GmbH,Berlin,Germany,"['Part-time', 'Contract']","Bist Du auf der Suche nach einem tollen Studierendenjob mit viel Eigenverantwortung in einem erfolgreichen Start-Up mitten im Herzen von Berlin? Dann bist Du bei uns genau richtig!MEDWING ist ein innovatives Start-up, das den Stellenmarkt im Gesundheitswesen revolutionieren wird. Wir vereinfachen das Recruiting von temporärem und festem Personal bis hin zu Praktika. Somit sollen sich Fachleute des Gesundheitswesens auf das konzentrieren können, was sie am besten können: Pflegen. Werde auch Du Teil des jungen und dynamischen Teams und hilf uns dabei, das Gesundheitssystem langfristig und nachhaltig zu verändern!DEINE AUFGABEN – SPANNEND UND HERAUSFORDERND!Du unterstützt unser Team bei der Rechnungsprüfung und der BelegerfassungDu erstellst Analysen und Reportings für das ManagementDu hilfst uns, unsere Prozesse im Bereich Finance kontinuierlich zu verbessernDu unterstützt bei den monatlichen und jährlichen Abschlüssen und den InvestorenreportsDEIN PROFIL – KOMMUNIKATIV, PRAGMATISCH UND MIT START-UP DRIVE!Bestenfalls studierst Du BWL bzw. eine Studienrichtung mit dem Schwerpunkt Finanz- oder Rechnungswesen.Idealerweise konntest Du bereits praktische Erfahrungen im Bereich Finanz- und Rechnungswesen sammeln.Du besitzt fundierte Kenntnisse in den gängigen MS-Office Anwendungen (insbesondere Excel).Du bist kommunikativ, engagiert. Eigeninitiative verbunden mit Teamgeist und Flexibilität zeichnen dich aus.DEINE BENEFITS – UNSCHLAGBAR UND VIELSEITIG!Modernes Office mit großer Dachterrasse in Berlin-Mitte mit sehr guter Anbindung per Bus und BahnSehr erfahrenes Gründerteam (HeavenHR, Home24, Bain)Tech-Driven Start-Up mit international renommierten InvestorenRabatte bei externen Partnern, tolle Company- und Teamevents, kostenlose Getränke und Bio-ObstEigenverantwortung & eine steile LernkurveEinzigartige Unternehmenskultur und eine Menge Spaß!Du hast Fragen zu Stellenprofil und Bewerbung? Dann wende dich direkt an Laura Nitzsche (Recruiting Managerin) unter 030-549082979.Nutze die Chance und werde Teil unseres großartigen Teams. Sende uns Deine aussagekräftige Bewerbung inklusive Startdatum über das Bewerbungsformular.Mehr Informationen und Eindrücke findest du hier: www.kununu.com/medwing.Art der Stelle: Teilzeit, WerkvertragSprache:Deutsch (Erforderlich)",,,indeed,vor 2 Tagen
Werkstudent (m/w/d) Finance,YoungCapital DE,Berlin,Germany,['Part-time'],"Du bist Vollzeitstudent (m/w/d) in der Studienrichtung BWL mit Schwerpunkt Controlling oder einer vergleichbaren Studienrichtung und möchtest dein theoretisches Wissen endlich praktisch anwenden? Dann bist du bei uns genau richtig. Wir suchen in Düsseldorf, Dortmund und weiteren Städten Deutschlands zuverlässige Werkstudenten (m/w/d) für die Unterstützung der Controlling & Finance-Teams unserer Kunden unterstützen? Dann bist du bei uns richtig. Bewirb dich jetzt und wir kontaktieren dich, sobald wir eine Vakanz in deiner Stadt haben! Was du machen wirst: Als Werkstudent (m/w/d) im Bereich Finance und Controlling kannst du unterschiedliche Aufgabenbereiche kennenlernen. Mögliche Aufgabenfelder könnten sein:  Assistenz im Bereich Controlling & Finance Erstellung von Kostenkalkulationen und Finanzplänen Buchung sämtlicher Geschäftsvorfälle aus den Bereichen Kreditoren, Debitoren, Anlagenbuchhaltung Unterstützung im Projekt- und Prozesscontrolling sowie bei Monats- und Jahresabschlüssen Bearbeitung und Buchung von Reisekosten sowie Mitwirkung bei der Rechnungsstellung Was wir bieten Du erhältst eine attraktive Vergütung von mindestens 12€/Stunde Anspruchsvolle Tätigkeit mit viel Selbständigkeit und Eigenverantwortung Intensive und systematische Einarbeitung Flexible Arbeitszeiten Was wir erwarten: Eingeschriebene/r Student/in an einer staatlich anerkannten Hochschule : Fachrichtung Betriebswirtschaft mit Schwerpunkt Controlling, Finance oder eine vergleichbare Studienrichtung Sicherer Umgang mit MS Office (insbesondere Excel) Hohe Eigenmotivation, Lernbereitschaft und Teamfähigkeit Bewerben Klingt das nach deinem Traumjob neben dem Studium? Dann zöger nicht und starte heute deine Finance & Controlling Karriere. Klicke auf Bewirb dich direkt und wir nehmen dich in unseren Pool auf. Wir freuen uns auf deine Bewerbung! Sobald wir eine passende Stelle für dich haben, melden wir uns bei dir.",,https://www.indeed.com/rc/clk?jk=2b2ff0c239c75183&from=vj&pos=top&spon=1&adid=273896205&sjdu=tZDv0YWt8ULnAiu55b0M1g0W-t_AG2nbwfFVVJjGcBR0pu-dFSM32cgBsmo3a6qmIXr4ZFITQNZKEr4QRFHQNsjkdx0e6DsIf0bDS59Ivyl15cmsoJIvWBquept5A4Wxqx48TZB5uKd2yv58CwchRfxqetx5BxS4p03o1hMg1LFHjKktrjqY2bQw3HblnOMi3d4H83WluBuMFiE6N662ZcLRQ8WhvYI0gidVsRIJah6oWfoWQmElvDbBshVIjHz4W_2LIt6LFWtCJ9IFN_sLcQ,indeed,
Werkstudent (m/w/d) Datenqualität,Talentfox GmbH,Berlin,,['Part-time'],"Was sind deine Aufgaben?Sie lernen zunächst die CRM-Prozesse im Verlagswesen kennen und arbeiten sich in die Bereiche Datenqualität und Kampagnenmanagement ein. Sie bearbeiten eigenverantwortlich die Werbesperren von Kunden sowie Werberückläufe und Dubletten im verlagseigenen CRM-System.Darüber hinaus sind Sie für die Bearbeitung von fehlerhaften Anschriften oder weiterer CRM-Datenfelder verantwortlich. Sie unterstützen die CRM-Manager im Tagesgeschäft.In dieser vielseitigen Position verstärken Sie unser Team im CRM bei folgenden Aufgaben:DublettenbereinigungSicherstellen der DatenqualitätUnterstützung der CRM-Manager im TagesgeschäftWie sieht dein Profil aus?Laufendes Studium an einer (Fach-) Hochschule in den Fächern BWL, VWL oder (Wirtschafts-)-InformatikIdealerweise Erfahrung mit qualitätssichernden AufgabenSehr gute MS-Office-Kenntnisse, insbes. ExcelErste Erfahrungen in Datenbank- und CRM-Systemen von VorteilKommunikations- und TeamfähigkeitWas bieten wir dir?Umfassende Einarbeitung und BetreuungSozial- & Gesundheitsleistungen, z. B. ein PhysiozentrumFlexible ArbeitszeitenKlingt interessant? Bewirb dich jetzt über Talentfox!Art der Stelle: Teilzeit",,,indeed,vor 30+ Tagen
Werkstudent (m/w/d) interne Kommunikation,univativ GmbH,Berlin,Germany,['Part-time'],"univativ ist ein Projekt- und Personaldienstleister, der Studenten und Absolventen spannende Jobs bei renommierten Unternehmen bietet. Deine Karriere ist unsere Mission, denn Deine Entwicklung liegt uns am Herzen.Du beherrschst PowerPoint weitestgehend im Schlaf und hast Lust Teil eines innovativen Finanzprojektes zu sein? Dann suchen wir Dich als Werkstudent (m/w/d) für Kommunikation im Finanzbereich. Du unterstützt das Projektteam bei der Realisierung einer Finanzplattform, die zur einfachen und transparenten Begleitung der persönlichen Finanzsituation von Kunden dienen soll. Du bist für die Darstellung der Projektergebnisse mittels verschiedener Kommunikationsformate zuständig und stehst hierfür in enger Kommunikation mit allen Beteiligten.Unser Kunde ist ein Verband aus der Bankbranche. Dich erwarten in unserem Projekt nicht nur eine kollegiale Arbeitsatmosphäre, sondern auch tiefgreifende Einblicke in die Arbeit eines Verbandes. Durch die Zusammenarbeit mit verschiedenen Experten kannst Du Deine Fähigkeiten weiterentwickeln und Dein Wissen in einem modernen Arbeitsumfeld vertiefen. Wenn Du einen kommunikativen Job während Deines Studiums suchst und bestenfalls bereits erste Erfahrung in der Banken- und/oder Finanzbranche vorweisen kannst, dann bewirb Dich noch heute!Das erlebst Du bei unsUnterstützung des Projektteams zur Entwicklung einer FinanzplattformAnalyse und Aufbereitung von Arbeitsergebnissen des gesamten ProjektsErstellung zielgruppengerechter Präsentationen und anderer Kommunikationsformate für die interne und externe Kommunikation der ProjektergebnisseEnge Kommunikation mit allen ProjektmitgliedernDas bieten wirRückmeldung innerhalb kürzester ZeitVielfältige Weiterbildungsmöglichkeiten in unserer univativ academyEinen persönlichen ProjektbetreuerCorporate Shopping und Rabatte für ausgewählte FitnessstudiosNetworking und MitarbeitereventsDeine QualifikationenEin laufendes Studium der BWL, Wirtschaftswissenschaften, im Finanzbereich oder vergleichbare FachrichtungFundierte Kenntnisse in MS PowerPointVerhandlungssichere DeutschkenntnisseEin hohes Maß an Detailgenauigkeit sowie die Fähigkeit den Fokus auf das Wesentliche zu legenEine ausgeprägte Kommunikations- und TeamfähigkeitArt der Stelle: TeilzeitStandort:Berlin (Erforderlich)",,,indeed,vor 30 Tagen
