Title,Company,City,Country,Type,Summary,Email,Website,Source,PostedDate
Werkstudent (m/w/d) im Bereich Controlling,ABB,Berlin,Germany,"['Part-time', 'Internship']","Kommen Sie zu ABB und gestalten Sie mit uns die Zukunft. In unseren Teams nutzen Sie innovative digitale Technologien, um einen besseren Zugang zu sauberer Energie zu schaffen. Wollen Sie über einen längeren Zeitraum hinter die Kulisse eines internationalen und zukunftsorientierten Unternehmens blicken? Kommen Sie zu uns als Werkstudent. Sammeln Sie parallel zu Ihrem Studium wertvolle Praxiserfahrung und übernehmen Sie als fest integriertes Teammitglied vielfältige Aufgaben im Tagesgeschäft. Und danach? Bei uns gibt es auch interessante Perspektiven für einen Berufseinstieg. Ihr Verantwortungsbereich Als Werkstudent unterstützen Sie unser Team unter anderem bei folgenden Tätigkeiten:  - Sachkonten- und Kostenstellenkontierung von Kreditorenrechnungen Erstellen von verschiedenen Business Warehouse ReportsErstellen von regelmäßigen overdue ReportsUnterstützung in Abwicklung des Reisekostenprozesses Ihr Hintergrund Sie sind immatrikuliert und studieren BWL oder einen vergleichbaren StudiengangDeutsch (mindestens Level C1) und Englisch beherrschen Sie fließend in Wort und Schrift.In den gängigen MS Office Tools haben Sie sich bereits fundierte Kenntnisse aneignen können.aufgeschlossen, neugierig,interessiertGrundsätzliches kaufmännisches VerständnisflexibelInteresse an Kommunikation mit KundenWeiterhin zeichnen Sie sich durch eine schnelle Auffassungsgabe aus und haben Spaß an der Zusammenarbeit im Team.",,https://www.indeed.com/rc/clk?jk=58fdb51e713b91a3&from=vj&pos=top,indeed,vor 5 Monaten
Vertriebs - Assistenz Werkstudent/in,VIRTENIO GmbH,Berlin,Germany,['Part-time'],"Für unser wachsendes & ambitioniertes Team suchen wir ab sofort eine/n Werkstudent/in mit hoher Motivation und Einsatzbereitschaft, die/der aktiv beim Aufbau des Vertriebs unterstützt!Das sind Deine AufgabenDeine Aufgabe ist es, den Vertrieb für unsere PreonSolutions Produkte weiter zu entwickelnDabei arbeitest Du eng mit dem Management zusammen und unterstützt uns direkt bei der AkquiseDu erstellst Vertriebskonzepte und bist aktiv in der Kundenansprache eingebundenWeiterhin bist Du mit der Vorbereitung und Umsetzung von Messen beschäftigt und erweiterst unseren KundenstammDazu baust Du Dir ein Team mit Praktikanten auf und führst dieseMit Deiner hohen Motivation profitierst Du von unserem Anreiz-System und lieferst wertvolles Kundenfeedback auch für die ProduktentwicklungDas sind Deine QualifikationenSehr hohe Motivation und ausgeprägtes VerkaufstalentSelbstständige und zielorientierte Arbeitsweise mit eigenen IdeenHerausragende kommunikative Fähigkeiten und sehr gute MenschenkenntnisSehr gute Deutsch-und EnglischkenntnisseSehr gute Belastbarkeit / Flexibilität bei Umsetzung von VertriebsreisenGute Kenntnisse im Umgang mit CRM-und MailingsystemenBegonnenes BWL-Studium oder Ausbildung im HandelsgewerbeErste VertriebserfahrungDas ist unser AngebotWir bieten Dir ein attraktives Anreiz-System, das Dich zusätzlich motiviertNeben einem großen Kontaktstamm profitierst Du auch von unserer guten BekanntheitDabei kannst Du sehr schnell Verantwortung beim aufstrebenden Start-Up übernehmenDu startest direkt mit abwechslungsreichen Aufgaben und erlebst unsere flachen HierarchieZudem lernst Du unsere unkomplizierte Unternehmenskultur kennen, die geprägt von Spaßund Leistungsorientierung istWir bieten Dir regelmäßige Teamevents, ein monatliches Teamfrühstück, einen Obstkorbsowie kalte und warme GetränkeDein Arbeitsplatz liegt in attraktiver und dynamischer Lage in Berlin-CharlottenburgWas macht VIRTENIO?Unsere Produkte helfen, daß Logistikprozesse transparenter, Produktionsabläufe flexibler und Wartungsprozesse effizienter werden! Dazu bringen wir Sensordaten von jedem Ort der Welt drahtlos und sicher in die Cloud und ma-chen so relevante Informationen 24h Stunden am Tag, 7 Tage die Woche von jedem Smartphone, Tablet oder PC weltweit per Browser, App oder Email-Alarm verfügbar! Unseren Kunden bieten wir den einfach zu nutzenden Komplettlösungs-Baukasten, der aus Sensor-Cubes, Gate-ways und einer Cloud-Plattform bestehtBewirb Dich!Werde Teil unseres erfolgshungrigen Teams. Wir freuen uns auf Deine aussagekräftige Bewerbung, in der Du auch darstellst, warum Du unbedingt zu VIRTENIO möchtest! Die Bewerbung soll Deine Persönlichkeit darstellen und einen Einblick über die bisherigen Erfahrungen eröffnen. Dabei soll der Fokus auf die Aufgaben und die erwarteten Qualifikationen liegen. Bitte sende uns Deinen Lebenslauf inkl. Foto, Deine Zeugnisse, Deine Gehaltsvorstellungen und ein Anschreiben!Besuche auch unsere Website unter http://www.virtenio.com/de/jobs.htmlArt der Stelle: Teilzeit",,,indeed,vor 20 Tagen
Werkstudent (d/f/m) Operations,optilyz GmbH,Berlin,Germany,"['Part-time', 'Internship']","Das ist optilyz: optilyz ist Europas führende Direct Mail Automation Software.Viele erfolgreiche Unternehmen (z. B. Conrad Electronics, HelloFresh, Orsay und Rewe) nutzen unsere Lösung, um Briefe, Postkarten & Co. automatisiert im Marketing einzusetzen. Mit Hilfe moderner Systematiken und künstlicher Intelligenz realisieren unsere Kunden so extrem profitable Cross-Channel-Kampagnen.Aktuell befinden wir uns in einer starken Wachstumsphase und vervielfachen jährlich unseren Umsatz. Hinter uns stehen einige der namhaftesten Investoren weltweit wie DN Capital (auch bei AUTO1, Mister Spex, Shazam investiert) und FJ Labs (#1 globaler Angel Investor nach Exits). Um unser Wachstum und unser Produkt weiterzuentwickeln, sind wir stets auf der Suche nach neuen Talenten. Bei uns bist Du Teil eines engagierten, motivierten und internationalen Teams, das mit viel Begeisterung und Drive die Mailing-Industrie umkrempelt. Wenn Du ab Tag eins Verantwortung übernehmen und unsere Mission mit Deinen Ideen und Fähigkeiten vorantreiben willst, bist Du bei uns genau richtig!Deine Aufgaben: Du hältst dem Operations-Team den Rücken bei administrativen Aufgaben freiDu unterstützt beim Ausbau und Management unseres LieferantennetzwerksDu betreust und verwaltest den Rechnungseingang und RechnungsausgangDu unterstützt bei der KampagnenabwicklungDein Profil: Du studierst im Bereich BWL oder ÄhnlichemDu bist ein guter Organisator und kannst strukturiert an Probleme herangehenIdealerweise hast Du bereits erste Erfahrungen im Operations gesammeltDu verfügst über sehr gute Englisch- und Deutschkenntnisse in Wort und SchriftWas wir bieten: Du arbeitest an der Seite von Gründern, die unter anderem für Rocket Internet Unternehmen gegründet haben und bei namhaften Consulting Firmen tätig warenDu profitierst von Expertenvorträgen sowie Knowledge-Sharing-SessionsDu bekommst die Chance Verantwortung zu übernehmen, eigene Projekte umzusetzen und Ideen einzubringenÜbernahmemöglichkeit bei guter PerformanceEine super Office Lage in Berlin Mitte sowie Getränke, Obst, Bier und regelmäßige TeameventsBereit für die Herausforderung? Dann freuen wir uns auf Deine Bewerbung, bestehend aus Lebenslauf und einer kurzen Mail mit Deinem idealen Startdatum und Zeitraum. Deine Ansprechpartnerin ist Indra Jonuscheit.Art der Stelle: Teilzeit, PraktikumStandort:10178 Berlin (Bevorzugt)",,,indeed,vor 30+ Tagen
Business Development Werkstudentin (m/f/d),7Learnings.com,Berlin,Germany,['Part-time'],"7Learnings ist ein junges Tech Startup mit dem Ziel, Automatisierung und Optimierung im Onlinehandel voranzutreiben. Unsere Software nutzt Machine Learning Methoden, um Vorhersagen für Onlinehändler zu generieren und auf Basis dieser ihre Preise zu optimieren.Wofür wir Deine Fähigkeiten brauchen- Unterstützung von Preis-Optimierungsprojekten mit analytischen Fähigkeiten- Entwickle Preisstrategien für spannende junge Kunden- Arbeiten an Kommunikation & Verbesserungen für bestehende Services- Visualisierung von Daten und Analysen in PräsentationenWonach wir suchen- Arbeitszeit bis zu 20h/Woche ab Oktober 2019- Gutes Gefühl für Zahlen- Abgeschlossenes Bachelor Studium in BWL, Ökonomie, Psychologie, Wirtschaftsingenieurwesen, Informatik Mathematik oder angrenzende Studiengänge- Ergebnisorientierter und pragmatischer CharakterArt der Stelle: TeilzeitGehalt: 14,00 € bis 15,00 € /StundeAusbildung:Bachelor (Erforderlich)Standort:10117 Berlin (Bevorzugt)",,,indeed,vor 21 Tagen
Business Management Intern / Werkstudent (m/w/d),REALCLOUD Services GmbH,Berlin-Friedrichshain,Germany,['Part-time'],"Stellenbeschreibung: REALCLOUD ist ein deutscher IT-Enterprise Solution Provider mit Sitz in Berlin. Das Unternehmen betreibt zwei Rechenzentren an den Standorten Berlin und Frankfurt am Main. Mehr als 165 Kunden vertrauen auf unsere Lösungen und Services. Die bewährten Enterprise IT-Lösungen der REALCLOUD richten sich an den deutschen Mittelstand. 2019 starten wir durch und werden einen deutschlandweiten Rollout umsetzen. Starte Deine Karriere bei REALCLOUD und werde Teil eines starken, professionellen und begeisterten Team im Herzen von Berlin.Diese Aufgaben erwarten Dich: Unterstützung des Managements im strategischen und operativen TagesgeschäftAktive Mitarbeit in der Qualifizierung von EndkundenleadsDurchführung von Markt-, Branchen-, Wettbewerbs- und ZielgruppenanalysenErstellen von Auswertungen und Präsentation für den VertriebUnterstützung im Termin-ManagementWas Du mitbringst: Du studierst BWL, VWL oder Wirtschaftsinformatik und bist mind. im 3-4 SemesterErste Praxiserfahrung aus den Bereichen Vertrieb, Marketing oder Business DevelopmentWünschenswert sind erste Einblicke in die IT- und Cloud-Welt, z.B. durch ein PraktikumAusgeprägte analytische Fähigkeiten und Spaß an Analysen und AuswertungenSystematische, zielgerichtete und selbständige ArbeitsweiseSehr guter Umgang mit MS-OfficeWas wir Dir bieten: Eine langfristige und abwechslungsreiche Tätigkeit in einem wachsenden MarktSpannende Projekte im Cloud-Umfeld mit Endkunden, Partnern und KundenFreie Getränke und gratis ObstRegelmäßige Team- und FirmeneventsArt der Stelle: TeilzeitArt der Stelle: TeilzeitSprache:Deutsch (Bevorzugt)",,,indeed,vor 30+ Tagen
Werkstudent/in Logistik & Operations,Liefery HQ,Berlin,Germany,['Part-time'],"Wir verstehen uns selbst als die Zukunft der letzten Meile im E-Commerce und revolutionieren als Same Day Delivery Plattform den Online Handel. Wie? Mit innovativen Servicekonzepten, modernster IT und logistischem Know How. Als Werkstudent/in unterstützt Du das Stationspersonal bei der Abwicklung der Touren.   Du unterstützt das Stationspersonal bei allen operativen Abläufen von der Warenannahme und -kontrolle über Tourenoptimierung bis hin zur Überwachung der Warenausgabe Dabei stehst Du im engen Austausch mit unseren Kurierfahrer/innen Du bist der/die Ansprechpartner/in, sobald es um die Betreuung und Beratung von unseren Kurierfahrer|innen bezüglich des gesamten Logistikprozesses geht Mit deiner Hands-On-Mentalität greifst du in schwierigen Situationen ein und kümmerst dich um einen reibungslosen operativen Tagesablauf   Du bist eingeschriebene/r Student/in im Bereich der Wirtschaftswissenschaften / BWL / Logistik oder einer anderen spannenden Fachrichtung Belastbarkeit, Zuverlässigkeit und Durchsetzungsvermögen gehören zu deinen Stärken Du verfügst über ausgeprägt analytische und konzeptionelle Fähigkeiten und kannst sowohl gut allein, als auch als Teil eines hochmotivierten Teams arbeiten Hohe Einsatzbereitschaft und Flexibilität zeichnen dich aus Du hast Kenntnisse mit MS Office Anwendungen (Word, Excel, Outlook) Du kannst unser Stationspersonal entweder in den Morgenstunden von 5:00 - 13:30 Uhr, abends von 16:30 - 00:30 Uhr oder von 12:00 - 20:00 Uhr unterstützen; idealerweise bist Du auch samstags einsatzbereit   Das bekommst Du nur bei Liefery:  Grundregel: Wer gute Ideen hat und sich engagiert, der kann bei uns alles machen und alles werden Keine Langeweile! Liefery ist ein Arbeitsumfeld, das jeden Tag in Bewegung ist Eine spannende und anspruchsvolle Position mit viel Gestaltungsspielraum Gemeinschaft ist bei uns alles. Liefery ist eine Familie, die nicht nur im Job zusammenhält Arbeitszeiten sind flexibel, denn wir richten uns nach deinem Studienplan Mach Dir Dein eigenes Bild von uns: Instagram | Facebook | YouTube   Wenn Du auf der Suche nach einer spannenden Herausforderung und einer offenen und teamorientierten Unternehmenskultur bist, dann freuen wir uns über Deine aussagekräftigen Bewerbungsunterlagen mit der Nennung des frühestmöglichen Eintrittstermins. Solltest Du Fragen haben, so melde Dich gerne bei mir: loan@liefery.com  LieferFactory GmbH  Montanstraße 18b  13407 Berlin",['loan@liefery.com'],https://www.indeed.com/rc/clk?jk=d192d8aa521ca6d1&from=vj&pos=top,indeed,vor 30+ Tagen
Werkstudent Customer Care / Backoffice (m/w/d),ubitricity Gesellschaft für verteilte Energiesyste...,Berlin,Germany,"['Full-time', 'Part-time', 'Temporary', 'Internship', 'Subcontract', 'Permanent']","Deine AufgabenIn unserem Customer Experience Team begleitest du unsere Kunden und Partner über den gesamten Customer Lifecycle. Die Beantwortung jeglicher E-Mails, von Kundenanfragen über Auskünfte zu Installations- und Versandvorgängen bis zu Supportfällen übertragen wir dir vertrauensvoll. Ebenfalls nimmst du telefonische Anliegen entgegen und koordinierst die interne Klärung. Du behältst stets den Überblick und hältst Rückmeldungen und Termine intern sowie extern verlässlich nach.Und falls dir noch das gewisse Extra fehlt, haben wir noch viele weitere spannende Aufgaben und Projekte in diesem Team, die du perspektivisch je nach Fähigkeit, Entwicklungswunsch und persönlichem Interesse übernehmen kannst. Darunter zählen zum Beispiel die Konzipierung von Reportings und Prozessbeschreibungen, Vorschläge und Umsetzung von Prozessverbesserungen, das Erstellen von FAQs und weiteren Vorlagen.Dein ProfilDu bist immatrikulierte/r Student/in einer deutschen Universität, gern im Bereich BWL, VWL, Energie, o.ä. (Quereinsteiger sind ebenfalls willkommen)Mit dem Office-Paket (Word, Excel, Outlook, etc.) kannst du professionell arbeitenMit unseren Kunden und Partnern schaffst du es stets freundlich, serviceorientiert und verbindlich zu kommunizierenDich zeichnen eine ausgesprochene hands-on Mentalität, Zuverlässigkeit sowie Selbstständigkeit ausInteresse an engeriewirtschaftlichen und technischen Themen bringst du ebenfalls mitentweder bist du verhandlungssicher in deutscher oder englischer SpracheUnser AngebotBei uns sammelst Du wertvolle Start-Up-Erfahrungen in einem motivierten und dynamischen Umfeld!Du wirst Teil eines zukunftsorientierten Start-ups, welches von weltweit führenden Energie- und Automobilunternehmen unterstützt wird.Auf dem innovativen und verkehrsgünstig gelegenen EUREF-Campus im Herzen von Berlin-Schöneberg wirst du ein wichtiger Bestandteil eines kreativen, sehr kollegialen Teams von hochmotivierten Talenten aus aller Welt.Gemeinsam entwickeln wir die Zukunftsthemen Elektromobilität, SmartCities und Energiewende weiter – definitiv ein Job mit Bedeutung – und das international und global.Deine Weiterentwicklung ist in unserem agilen, innovativen und wachstumsstarken Umfeld gesichert, denn es gibt spannende Entwicklungsmöglichkeiten und viel Freiraum für Deine eigenen Ideen.Regelmäßig organisieren wir soziale Events, Sportveranstaltungen und bieten kostenloses Obst und Getränken an.Deine BewerbungWir lernen ebenfalls täglich dazu und wachsen mit unseren Herausforderungen, daher sollten Dich noch nicht vorhandene Teilkenntnisse nicht davon abhalten Dich zu bewerben. Wir freuen uns auf Deine Bewerbung, mit den Angaben zu wann Du bei uns starten kannst und Deiner Gehaltsvorstellung.Art der Stelle: Vollzeit, Teilzeit, Befristet, Praktikum, Freie Mitarbeit, Festanstellung",,,indeed,vor 30 Tagen
Werkstudent/ Praktikant Marketing Pharma (m/w/d),Bausch + Lomb,Berlin,Germany,['Part-time'],"Ihr Tätigkeitsbereich: Unterstützung des Marketing-Teams im operativen Tagesgeschäft Unterstützung und möglichst eigenständiges Handling im Bereich Werbematerialien (Bestellungen, Datenerstellung, Kontakt zu Agenturen und internen Abteilungen, Handling interner Prozesse, Lager, Monitoring der aktuellen Bestände) und Unterstützung bei der Konzeption und Umsetzung von Digital- und HCP-Maßnahmen Aufbereitung und Analyse von Markt- und Absatzdaten Vorbereitung von Messen und Tagungen Erstellung, Implementierung und Kontrolle von E-Mail Marketing  eigenständige Projekte im operativen und strategischen Bereich  Ihr Profil: laufendes Studium: BWL, Marketing, Consumer Healthcare oder Ähnliches, möglichst mit Schwerpunkt Marketing Erste Erfahrungen im Consumer Healthcare Bereich und/oder Marketing sind ein Plus Eigenständige Arbeitsweise, Organisationsstärke, Teamfähigkeit Gute mündliche und schriftliche Ausdrucksfähigkeit in Deutsch und Englisch Gutes bis sehr gutes Beherrschen von Power Point, Word und Excel Längerfristige Verfügbarkeit als Werkstudent/in (Immatrikulation notwendig) Consumer-Brand und zielorientiertes Arbeiten sind für Sie keine Fremdwörter Sie sind: kreativ, digital affin, ambitioniert, dynamisch und bereit sich neuen Herausforderungen zu stellen  Wir bieten: einen Einblick in ein modernes, internationales Unternehmen die Möglichkeit einer persönlichen sowie fachlichen Weiterentwicklung die Mitarbeit in einem hochmotivierten Team und die Möglichkeit einer längeren Zusammenarbeit  Wir freuen uns auf Ihre Bewerbung!",,https://www.indeed.com/rc/clk?jk=0ee603076137e366&from=vj&pos=top,indeed,vor 14 Tagen
"Werkstudent Marketing (Online & Offline), 3 Monate ab sofort in Berlin",SMACC GmbH,Berlin,Germany,"['Part-time', 'Internship']","Über uns Seit 2015 ist SMACC eines der innovativsten Software-Unternehmen in Deutschland. SMACC setzt auf modernste Cloud- und KI-Technologie um manuelle Verarbeitungsprozesse in der Finanzabteilung von Organisationen jeder Größe zu automatisieren. Unsere Automatisierungslösungen und -Anwendungen helfen Unternehmen und Finanzexperten effizienter zu werden, Transparenz zu gewinnen und mehr Kontrolle zu erlangen. Für unsere innovativen Lösungen wurden wir mit zahlreichen Preisen ausgezeichnet. Wir bieten die Chance für kluge, technologie-begeisterte Köpfe in einem starken Team etwas zu bewegen. Ihre Aufgaben Mitarbeit bei der Planung, Steuerung und Abwicklung von Marketing Initiativen auf verschiedenen Kanälen (online und offline) Dein erstes Projekt wird die Planung und Umsetzung eines Events: (kreative) Planung, Teilnehmerkorrespondenz, Exekution, und Nachbereitung Nach erfolgreicher Durchführung haben wir weitere spannende Marketing Projekte, deshalb konntest du idealerweise schon Erfahrung in folgenden Bereichen sammeln: AdWords, Google Analytics, Kampagnen Launch LinkedIn & Facebook, LeadGens, Betreuung von Printkampagnen, allgemeines Verständnis von KPIs. Anforderungen Studienrichtung: BWL/VWL Erste einschlägige Praktika („Hands on“ Mentalität aus Startups erwünscht) Sehr gute MS-Office-Kenntnisse (insbesondere Word, Excel und PowerPoint) Sehr gute Deutsch- und Englischkenntnisse Starttermin ab sofort Unser Angebot Cooles Office im Herzens Berlin: WeWork. Freibier ab 15Uhr J Dynamische Arbeitsatmosphäre und eine steile Lernkurve. Unser Team besteht aus Experten: Harvard PhD, Quantenphysiker, Marketing Experten (Inhouse & Agenturen), Front- und Backend Developer",,https://www.indeed.com/rc/clk?jk=c878f9f0b5ff6560&from=vj&pos=top,indeed,vor 30+ Tagen
Werkstudent/in Social Media Monitoring (m/f/d),StoryMachine GmbH,Berlin-Kreuzberg,Germany,"['Part-time', 'Contract']","Wir suchen zum nächstmöglichen Zeitpunkt eine/n Werkstudenten/in (m/f/d) zur Verstärkung unseres Teams: StoryMachine ist eine 2017 gegründete Social-Media-Agentur mit dem Schwerpunkt auf strategischem Storytelling für Brands, Persönlichkeiten und politische Institutionen. Die Basis unseres integrativen Storytellings ist journalistisch und komplett datengetrieben. Wir betrachten Social Channels nicht isoliert, sondern heben ihre Stärken und Besonderheiten hervor und bringen sie zum Vorteil unserer Kunden ein.Als Werkstudent/in übernimmst du ab dem ersten Tag Verantwortung und bist ein fester Bestandteil unseres Newsrooms. Dabei bist du Ideengeber und arbeitest an spannenden Projekten.Deine Aufgaben: Ein Fokus deiner Arbeit wird auf der Auswertung von Kampagnen auf allen relevanten Social Media-Kanälen liegenUnterstützung im operativen Tagesgeschäft bei der Betreuung unserer KundenMitwirkung bei der Entwicklung eines Dashboards und anderer operativer Reports für den Bereich Public Affairs / Personal Branding (Wirtschaft)Erarbeitung und Umsetzung von Ideen zur Effizienzsteigerung im Rahmen des Monitoring in weiterführenden ReportingsVor- und Nachbereitung, sowie Präsentation von internen MeetingsIn Absprache mit unseren Performance Marketing-Experten kreierst Du Handlungsempfehlungen zur Optimierung der Kampagne, um bestmöglichen Erfolg zu garantierenDu bringst mit: Mindestens 2. Fachsemester im Bereich BWL, Kommunikationswissenschaften, Medienwirtschaft, Marketing, Politikwissenschaft oder WirtschaftDu bringst Begeisterung und Erfahrung im Umgang mit Social Media-Plattformen mitBereitschaft am Wochenende zu arbeitenStrukturierte, selbstständige Arbeitsweise, sowie ein hoher QualitätsanspruchDigital-Expertise und Gespür für digitale TrendsGute praktische Erfahrungen mit Excel (z.B. Pivot, Grafiken)Teamfähigkeit, Kommunikationsstärke sowie DurchsetzungsvermögenZahlenaffinität und starke analytische FähigkeitenGute Kenntnisse in Deutsch und EnglischUnser Versprechen: Wir bieten Dir Freiräume, um deine persönliche Erfolgsgeschichte zu schreiben. Du trägst Verantwortung und bist in den Top-Management Entscheidungen von großer Tragweite involviert. Zudem kannst du dich auf regelmäßige Networking Events mit ranghohen Politikern und Medienvertretern, vielfältige Coachingangebote, Team Lunches, Fun- Mondays und den StoryMachine E-Roller freuen.Art der Stelle: Teilzeit, WerkvertragSprache:Englisch (Bevorzugt)Deutsch (Erforderlich)",,,indeed,
Werkstudent Product Management (m/w/x),Homeday GmbH,Berlin,Germany,['Part-time'],"Bei Homeday glauben wir fest daran, dass es durch Digitalisierung einen besseren Weg zum Kauf und Verkauf von Immobilien gibt: Einfacher, transparenter und effizienter. Dafür verbinden wir unsere einzigartige Technologie mit professioneller, persönlicher Beratung und Maklern vor Ort, die über lokale Marktkenntnisse verfügen.Wir sind 2014 gestartet und stehen mit unserem Team von über 100 Mitarbeitern an der Schwelle vom Startup zur professionellen Tech-Company. Bereits jetzt sind wir eine der größten Plattformen in Deutschland für den Immobilienverkauf und die passende Maklersuche, und wir haben große Pläne: Wir möchten weltweit zur ersten Anlaufstelle für Eigentümer werden, die eine Immobilie verkaufen. Dafür brauchen wir deine tatkräftige Unterstützung!Als Werkstudent Product Management (m/w/x) sind deine Tätigkeiten vielseitig und kreativ: Als Werkstudent (m/w/x) im Product Management wirst du Teil eines internationalen Teams aus den Bereichen Produktmanagement, Design und EntwicklungDu unterstützt unser Team bei der Verbesserung von bestehenden Produkten sowie Neuentwicklungen und arbeitest eng mit unserem Produktmanager zusammenIm Bereich User Research unterstützt du uns bei der Konzeptionierung, Durchführung und Auswertung von User InterviewsNeben den User-Interviews führst du Web Recherchen durch und beobachtest den Markt zur Identifizierung von Trends in diesem BereichDu unterstützt unser Team bei der Konzeption und Spezifikation von Product-FeaturesDu erstellst Testszenarien für die einzelnen Features in enger Zusammenarbeit mit unserem ProduktmanagerIm Anschluss testest du die neuen Product-Features mit unserem iPad und iPhone sowie auf dem Desktop aus User-SichtDein Profil: Du bist aktuell an einer Hochschule oder Universität immatrikuliert und studierst idealerweise Produktmanagement Informatik, Wirtschaftsingenieurwesen, BWL oder ÄhnlichesDich begeistern neue Technologien und Software und hast ein Auge für DetailsErste Berührungspunkte mit dem Produktmanagement und Software-Testing sind nice to have, aber kein MussDeine Arbeitsweise ist strukturiert und selbständigDeine Deutsch- und Englischkenntnisse sind fließendDas bieten wir Dir: Wir sind ein motiviertes Team mit positiver Aufbruchstimmung, familiärer Atmosphäre und gelebter FeedbackkulturDu steigst in einer spannenden Zeit des Wachstums ein, kannst die Entwicklung von Homeday aktiv mitgestalten und deine Fußspuren hinterlassenDeine Arbeitszeit kannst du flexibel und familienfreundlich einteilen -Auch der eine oder andere Tag im Homeoffice ist kein ProblemWenn du Lust hast, ein „erwachsenes“ Startup mit nachhaltiger Unternehmensvision aufzubauen, bist du bei uns richtigArt der Stelle: Teilzeit",,,indeed,
